{
  "catalogVersion": "2.0.0",
  "defaultLanguagePairId": "en-hi",
  "languages": [
    {"id":"en","name":"English","nativeName":"English","script":"Latin","locale":"en-US"},
    {"id":"hi","name":"Hindi","nativeName":"हिन्दी","script":"Devanagari","locale":"hi-IN"},
    {"id":"kn","name":"Kannada","nativeName":"ಕನ್ನಡ","script":"Kannada","locale":"kn-IN"},
    {"id":"te","name":"Telugu","nativeName":"తెలుగు","script":"Telugu","locale":"te-IN"},
    {"id":"ta","name":"Tamil","nativeName":"தமிழ்","script":"Tamil","locale":"ta-IN"},
    {"id":"ml","name":"Malayalam","nativeName":"മലയാളം","script":"Malayalam","locale":"ml-IN"},
    {"id":"mr","name":"Marathi","nativeName":"मराठी","script":"Devanagari","locale":"mr-IN"},
    {"id":"bn","name":"Bengali","nativeName":"বাংলা","script":"Bengali","locale":"bn-IN"},
    {"id":"gu","name":"Gujarati","nativeName":"ગુજરાતી","script":"Gujarati","locale":"gu-IN"},
    {"id":"pa","name":"Punjabi","nativeName":"ਪੰਜਾਬੀ","script":"Gurmukhi","locale":"pa-IN"},
    {"id":"ur","name":"Urdu","nativeName":"اردو","script":"Perso-Arabic","locale":"ur-IN"},
    {"id":"or","name":"Odia","nativeName":"ଓଡ଼ିଆ","script":"Odia","locale":"or-IN"},
    {"id":"as","name":"Assamese","nativeName":"অসমীয়া","script":"Bengali","locale":"as-IN"},
    {"id":"ne","name":"Nepali","nativeName":"नेपाली","script":"Devanagari","locale":"ne-NP"},
    {"id":"sa","name":"Sanskrit","nativeName":"संस्कृतम्","script":"Devanagari","locale":"sa-IN"}
  ],
  "languagePairs": [
    {"id":"en-hi","sourceLanguageId":"en","targetLanguageId":"hi"},{"id":"hi-en","sourceLanguageId":"hi","targetLanguageId":"en"},
    {"id":"en-kn","sourceLanguageId":"en","targetLanguageId":"kn"},{"id":"kn-en","sourceLanguageId":"kn","targetLanguageId":"en"},
    {"id":"en-te","sourceLanguageId":"en","targetLanguageId":"te"},{"id":"te-en","sourceLanguageId":"te","targetLanguageId":"en"},
    {"id":"en-ta","sourceLanguageId":"en","targetLanguageId":"ta"},{"id":"ta-en","sourceLanguageId":"ta","targetLanguageId":"en"},
    {"id":"en-ml","sourceLanguageId":"en","targetLanguageId":"ml"},{"id":"ml-en","sourceLanguageId":"ml","targetLanguageId":"en"},
    {"id":"en-mr","sourceLanguageId":"en","targetLanguageId":"mr"},{"id":"mr-en","sourceLanguageId":"mr","targetLanguageId":"en"},
    {"id":"en-bn","sourceLanguageId":"en","targetLanguageId":"bn"},{"id":"bn-en","sourceLanguageId":"bn","targetLanguageId":"en"},
    {"id":"en-gu","sourceLanguageId":"en","targetLanguageId":"gu"},{"id":"gu-en","sourceLanguageId":"gu","targetLanguageId":"en"},
    {"id":"en-pa","sourceLanguageId":"en","targetLanguageId":"pa"},{"id":"pa-en","sourceLanguageId":"pa","targetLanguageId":"en"},
    {"id":"en-ur","sourceLanguageId":"en","targetLanguageId":"ur"},{"id":"ur-en","sourceLanguageId":"ur","targetLanguageId":"en"},
    {"id":"en-or","sourceLanguageId":"en","targetLanguageId":"or"},{"id":"or-en","sourceLanguageId":"or","targetLanguageId":"en"},
    {"id":"en-as","sourceLanguageId":"en","targetLanguageId":"as"},{"id":"as-en","sourceLanguageId":"as","targetLanguageId":"en"},
    {"id":"en-ne","sourceLanguageId":"en","targetLanguageId":"ne"},{"id":"ne-en","sourceLanguageId":"ne","targetLanguageId":"en"},
    {"id":"en-sa","sourceLanguageId":"en","targetLanguageId":"sa"},{"id":"sa-en","sourceLanguageId":"sa","targetLanguageId":"en"}
  ],
  "curricula": [
    {"languageId":"hi","lessons":[
      {"key":"greetings","title":"Greetings","titleNative":"अभिवादन","words":[{"english":"Hello","native":"नमस्ते","transliteration":"namaste"},{"english":"Thank you","native":"धन्यवाद","transliteration":"dhanyavaad"},{"english":"Yes","native":"हाँ","transliteration":"haan"},{"english":"No","native":"नहीं","transliteration":"nahin"}]},
      {"key":"everyday","title":"Everyday words","titleNative":"रोज़मर्रा के शब्द","words":[{"english":"Water","native":"पानी","transliteration":"paani"},{"english":"Food","native":"खाना","transliteration":"khaana"},{"english":"Book","native":"किताब","transliteration":"kitaab"},{"english":"Home","native":"घर","transliteration":"ghar"}]},
      {"key":"people","title":"People and polite phrases","titleNative":"लोग और विनम्र वाक्य","words":[{"english":"I","native":"मैं","transliteration":"main"},{"english":"You","native":"आप","transliteration":"aap"},{"english":"Friend","native":"दोस्त","transliteration":"dost"},{"english":"Please","native":"कृपया","transliteration":"kripaya"}]}
    ]},
    {"languageId":"kn","lessons":[
      {"key":"greetings","title":"Greetings","titleNative":"ಶುಭಾಶಯಗಳು","words":[{"english":"Hello","native":"ನಮಸ್ಕಾರ","transliteration":"namaskara"},{"english":"Thank you","native":"ಧನ್ಯವಾದ","transliteration":"dhanyavaada"},{"english":"Yes","native":"ಹೌದು","transliteration":"haudu"},{"english":"No","native":"ಇಲ್ಲ","transliteration":"illa"}]},
      {"key":"everyday","title":"Everyday words","titleNative":"ದಿನನಿತ್ಯದ ಪದಗಳು","words":[{"english":"Water","native":"ನೀರು","transliteration":"neeru"},{"english":"Food","native":"ಊಟ","transliteration":"oota"},{"english":"Book","native":"ಪುಸ್ತಕ","transliteration":"pustaka"},{"english":"Home","native":"ಮನೆ","transliteration":"mane"}]},
      {"key":"people","title":"People and polite phrases","titleNative":"ಜನರು ಮತ್ತು ಸೌಜನ್ಯದ ನುಡಿಗಳು","words":[{"english":"I","native":"ನಾನು","transliteration":"naanu"},{"english":"You","native":"ನೀವು","transliteration":"neevu"},{"english":"Friend","native":"ಸ್ನೇಹಿತ","transliteration":"snehita"},{"english":"Please","native":"ದಯವಿಟ್ಟು","transliteration":"dayavittu"}]}
    ]},
    {"languageId":"te","lessons":[
      {"key":"greetings","title":"Greetings","titleNative":"అభివాదాలు","words":[{"english":"Hello","native":"నమస్కారం","transliteration":"namaskaaram"},{"english":"Thank you","native":"ధన్యవాదాలు","transliteration":"dhanyavaadaalu"},{"english":"Yes","native":"అవును","transliteration":"avunu"},{"english":"No","native":"కాదు","transliteration":"kaadu"}]},
      {"key":"everyday","title":"Everyday words","titleNative":"రోజువారీ పదాలు","words":[{"english":"Water","native":"నీరు","transliteration":"neeru"},{"english":"Food","native":"ఆహారం","transliteration":"aahaaram"},{"english":"Book","native":"పుస్తకం","transliteration":"pustakam"},{"english":"Home","native":"ఇల్లు","transliteration":"illu"}]},
      {"key":"people","title":"People and polite phrases","titleNative":"వ్యక్తులు మరియు మర్యాదపూర్వక పదాలు","words":[{"english":"I","native":"నేను","transliteration":"nenu"},{"english":"You","native":"మీరు","transliteration":"meeru"},{"english":"Friend","native":"స్నేహితుడు","transliteration":"snehitudu"},{"english":"Please","native":"దయచేసి","transliteration":"dayachesi"}]}
    ]},
    {"languageId":"ta","lessons":[
      {"key":"greetings","title":"Greetings","titleNative":"வாழ்த்துகள்","words":[{"english":"Hello","native":"வணக்கம்","transliteration":"vanakkam"},{"english":"Thank you","native":"நன்றி","transliteration":"nandri"},{"english":"Yes","native":"ஆம்","transliteration":"aam"},{"english":"No","native":"இல்லை","transliteration":"illai"}]},
      {"key":"everyday","title":"Everyday words","titleNative":"அன்றாடச் சொற்கள்","words":[{"english":"Water","native":"தண்ணீர்","transliteration":"thanneer"},{"english":"Food","native":"உணவு","transliteration":"unavu"},{"english":"Book","native":"புத்தகம்","transliteration":"puthagam"},{"english":"Home","native":"வீடு","transliteration":"veedu"}]},
      {"key":"people","title":"People and polite phrases","titleNative":"மக்கள் மற்றும் மரியாதைச் சொற்கள்","words":[{"english":"I","native":"நான்","transliteration":"naan"},{"english":"You","native":"நீங்கள்","transliteration":"neengal"},{"english":"Friend","native":"நண்பர்","transliteration":"nanbar"},{"english":"Please","native":"தயவுசெய்து","transliteration":"dayavuseythu"}]}
    ]},
    {"languageId":"ml","lessons":[
      {"key":"greetings","title":"Greetings","titleNative":"അഭിവാദ്യങ്ങൾ","words":[{"english":"Hello","native":"നമസ്കാരം","transliteration":"namaskaaram"},{"english":"Thank you","native":"നന്ദി","transliteration":"nandi"},{"english":"Yes","native":"അതെ","transliteration":"athe"},{"english":"No","native":"ഇല്ല","transliteration":"illa"}]},
      {"key":"everyday","title":"Everyday words","titleNative":"ദൈനംദിന വാക്കുകൾ","words":[{"english":"Water","native":"വെള്ളം","transliteration":"vellam"},{"english":"Food","native":"ഭക്ഷണം","transliteration":"bhakshanam"},{"english":"Book","native":"പുസ്തകം","transliteration":"pustakam"},{"english":"Home","native":"വീട്","transliteration":"veedu"}]},
      {"key":"people","title":"People and polite phrases","titleNative":"ആളുകളും മര്യാദയുള്ള വാക്കുകളും","words":[{"english":"I","native":"ഞാൻ","transliteration":"njaan"},{"english":"You","native":"നിങ്ങൾ","transliteration":"ningal"},{"english":"Friend","native":"സുഹൃത്ത്","transliteration":"suhruth"},{"english":"Please","native":"ദയവായി","transliteration":"dayavaayi"}]}
    ]},
    {"languageId":"mr","lessons":[
      {"key":"greetings","title":"Greetings","titleNative":"अभिवादन","words":[{"english":"Hello","native":"नमस्कार","transliteration":"namaskaar"},{"english":"Thank you","native":"धन्यवाद","transliteration":"dhanyavaad"},{"english":"Yes","native":"होय","transliteration":"hoy"},{"english":"No","native":"नाही","transliteration":"naahi"}]},
      {"key":"everyday","title":"Everyday words","titleNative":"दैनंदिन शब्द","words":[{"english":"Water","native":"पाणी","transliteration":"paani"},{"english":"Food","native":"जेवण","transliteration":"jevan"},{"english":"Book","native":"पुस्तक","transliteration":"pustak"},{"english":"Home","native":"घर","transliteration":"ghar"}]},
      {"key":"people","title":"People and polite phrases","titleNative":"लोक आणि नम्र शब्द","words":[{"english":"I","native":"मी","transliteration":"mi"},{"english":"You","native":"तुम्ही","transliteration":"tumhi"},{"english":"Friend","native":"मित्र","transliteration":"mitra"},{"english":"Please","native":"कृपया","transliteration":"krupaya"}]}
    ]},
    {"languageId":"bn","lessons":[